{
  "$schema": "https://json-schema.org/draft/2020-12/schema",
  "$id": "https://volmit.com/gloss/leaderboards.schema.json",
  "title": "Gloss Leaderboard Document",
  "description": "One computed top-N list at plugins/Gloss/leaderboards/<id>.json, sampled by Gloss and readable as leaderboard.<id>.* from every surface.",
  "type": "object",
  "required": [
    "schemaVersion",
    "revision",
    "source"
  ],
  "properties": {
    "preset": {"type": ["string", "null"], "minLength": 1, "description": "Named preset from this collection in presets.json; document fields override inherited values."},
    "schemaVersion": {
      "type": "integer",
      "const": 1
    },
    "revision": {
      "type": "integer",
      "minimum": 1,
      "maximum": 9007199254740991
    },
    "source": {
      "type": "object",
      "required": ["type"],
      "properties": {
        "type": {
          "type": "string",
          "enum": ["papi", "statistic", "metric"]
        },
        "placeholder": {
          "type": "string",
          "description": "Required for type papi. A PlaceholderAPI token, with or without the % wrapper."
        },
        "statistic": {
          "type": "string",
          "description": "Required for type statistic. A Bukkit Statistic name such as PLAY_ONE_MINUTE."
        },
        "material": {
          "type": "string",
          "description": "Required when the statistic is keyed by a block or item."
        },
        "entity": {
          "type": "string",
          "description": "Required when the statistic is keyed by an entity type."
        },
        "key": {
          "type": "string",
          "description": "Required for type metric. Refused at load until a plugin publishes per-player metric groups."
        }
      }
    },
    "size": {
      "type": "integer",
      "minimum": 1,
      "maximum": 1000,
      "default": 10,
      "description": "Ranked entries kept; also clamped by [leaderboards] maxEntries."
    },
    "order": {
      "type": "string",
      "enum": ["desc", "asc"],
      "default": "desc"
    },
    "reset": {
      "type": "string",
      "enum": ["never", "hourly", "daily", "weekly", "monthly"],
      "default": "never",
      "description": "Period boundary in UTC. All-time totals are kept alongside the period bucket."
    },
    "includeOffline": {
      "type": "boolean",
      "default": true,
      "description": "Keeps the last sampled value for players who are not online."
    },
    "format": {
      "type": "object",
      "properties": {
        "value": {
          "type": "string",
          "default": "{{ value }}",
          "description": "Rendered once per recompute. Reads value and name."
        },
        "name": {
          "type": "string",
          "default": "{{ name }}",
          "description": "Rendered once per recompute. Reads value and name."
        }
      }
    },
    "sample": {
      "type": "object",
      "properties": {
        "playersPerTick": {
          "type": "integer",
          "minimum": 1,
          "maximum": 64,
          "default": 8
        }
      }
    }
  }
}
